{"$schema":"https://json-schema.org/draft/2020-12/schema","$id":"https://github.com/safal207/LS/fixtures/operational-continuity/inter-agent-dispatch-audit/schema-v0.1.json","title":"Inter-Agent Dispatch Audit Conformance Fixture v0.1","type":"object","required":["_meta","fixture_id","contract_version","canonical_record","negative_vectors","expected"],"properties":{"_meta":{"type":"object","required":["role","contract_version","related_issue","boundary_invariants"],"properties":{"role":{"type":"string","minLength":1},"contract_version":{"const":"inter-agent-dispatch-audit/v0.1"},"related_issue":{"type":"string","format":"uri"},"boundary_invariants":{"type":"array","minItems":5,"items":{"type":"string","minLength":1}}},"additionalProperties":false},"fixture_id":{"const":"encrypted_inter_agent_dispatch_chain"},"contract_version":{"const":"inter-agent-dispatch-audit/v0.1"},"canonical_record":{"$ref":"#/$defs/auditRecord"},"negative_vectors":{"type":"array","minItems":14,"allOf":[{"contains":{"const":{"case":"missing_authorized_exact_content","mutation":{"op":"delete","path":"dispatches[0].payload.authorized_view.exact_content"},"expected_error_code":"AUTHORIZED_EXACT_CONTENT_MISSING"}}},{"contains":{"const":{"case":"ui_only_without_machine_readable_audit","mutation":{"op":"set","path":"machine_readable_audit.available","value":false},"expected_error_code":"AUDIT_SURFACE_MISSING"}}},{"contains":{"const":{"case":"missing_followup_parent_link","mutation":{"op":"delete","path":"dispatches[1].parent_dispatch_id"},"expected_error_code":"PARENT_DISPATCH_MISSING"}}},{"contains":{"const":{"case":"ambiguous_followup_order","mutation":{"op":"set","path":"dispatches[1].sequence","value":1},"expected_error_code":"DISPATCH_SEQUENCE_INVALID"}}},{"contains":{"const":{"case":"result_omits_effective_followup","mutation":{"op":"set","path":"result.effective_dispatch_ids","value":["dispatch-root-child-001"]},"expected_error_code":"RESULT_DISPATCH_BINDING_INCOMPLETE"}}},{"contains":{"const":{"case":"authorized_content_changed_without_digest_update","mutation":{"op":"set","path":"dispatches[1].payload.authorized_view.exact_content","value":"FOLLOWUP_AUDIT_SENTINEL_MUTATED."},"expected_error_code":"CONTENT_DIGEST_MISMATCH"}}},{"contains":{"const":{"case":"missing_root_parent_key","mutation":{"op":"delete","path":"dispatches[0].parent_dispatch_id"},"expected_error_code":"ROOT_PARENT_MISSING"}}},{"contains":{"const":{"case":"self_parent_followup","mutation":{"op":"set","path":"dispatches[1].parent_dispatch_id","value":"dispatch-root-child-002"},"expected_error_code":"PARENT_DISPATCH_MISSING"}}},{"contains":{"const":{"case":"invalid_root_operation","mutation":{"op":"set","path":"dispatches[0].operation","value":"followup_task"},"expected_error_code":"ROOT_OPERATION_INVALID"}}},{"contains":{"const":{"case":"invalid_dispatch_timestamp","mutation":{"op":"set","path":"dispatches[1].timestamp","value":"not-a-timeZ"},"expected_error_code":"TIMESTAMP_INVALID"}}},{"contains":{"const":{"case":"invalid_leap_second_timestamp","mutation":{"op":"set","path":"dispatches[1].timestamp","value":"2026-07-13T10:00:60Z"},"expected_error_code":"TIMESTAMP_INVALID"}}},{"contains":{"const":{"case":"malformed_result_digest","mutation":{"op":"set","path":"result.output_digest","value":"sha256:bogus"},"expected_error_code":"RESULT_DIGEST_INVALID"}}},{"contains":{"const":{"case":"missing_required_result_id","mutation":{"op":"delete","path":"result.result_id"},"expected_error_code":"SCHEMA_VALIDATION_FAILED"}}},{"contains":{"const":{"case":"malformed_content_digest","mutation":{"op":"set","path":"dispatches[0].payload.content_digest","value":"sha256:bogus"},"expected_error_code":"CONTENT_DIGEST_INVALID"}}}],"items":{"type":"object","required":["case","mutation","expected_error_code"],"properties":{"case":{"type":"string","minLength":1},"mutation":{"type":"object","required":["op","path"],"properties":{"op":{"enum":["set","delete"]},"path":{"type":"string","minLength":1},"value":{}},"additionalProperties":false},"expected_error_code":{"type":"string","minLength":1}},"additionalProperties":false}},"expected":{"type":"object","required":["canonical_passes","negative_vectors_rejected"],"properties":{"canonical_passes":{"const":true},"negative_vectors_rejected":{"const":true}},"additionalProperties":false}},"$defs":{"auditRecord":{"type":"object","required":["security","machine_readable_audit","dispatches","result"],"properties":{"security":{"type":"object","required":["rollout_storage","operator_access","default_transcript_visibility"],"properties":{"rollout_storage":{"const":"encrypted"},"operator_access":{"const":"authorized"},"default_transcript_visibility":{"const":"redacted"}},"additionalProperties":false},"machine_readable_audit":{"type":"object","required":["available","surface","format"],"properties":{"available":{"const":true},"surface":{"enum":["app_server","hook","audit_export"]},"format":{"const":"json"}},"additionalProperties":false},"dispatches":{"type":"array","minItems":1,"prefixItems":[{"allOf":[{"$ref":"#/$defs/dispatch"},{"type":"object","required":["operation","parent_dispatch_id"],"properties":{"operation":{"const":"spawn_agent"},"parent_dispatch_id":{"const":null}}}]}],"items":{"$ref":"#/$defs/dispatch"}},"result":{"$ref":"#/$defs/result"}},"additionalProperties":false},"dispatch":{"type":"object","required":["dispatch_id","operation","sender_thread_id","recipient_thread_id","sequence","timestamp","parent_dispatch_id","payload"],"properties":{"dispatch_id":{"type":"string","minLength":1},"operation":{"enum":["spawn_agent","send_message","followup_task"]},"sender_thread_id":{"type":"string","minLength":1},"recipient_thread_id":{"type":"string","minLength":1},"sequence":{"type":"integer","minimum":1},"timestamp":{"type":"string","format":"date-time"},"parent_dispatch_id":{"type":["string","null"]},"payload":{"type":"object","required":["storage_mode","content_digest","authorized_view"],"properties":{"storage_mode":{"const":"encrypted"},"content_digest":{"type":"string","pattern":"^sha256:[0-9a-f]{64}$"},"authorized_view":{"type":"object","required":["access","exact_content"],"properties":{"access":{"const":"granted"},"exact_content":{"type":"string","minLength":1}},"additionalProperties":false}},"additionalProperties":false}},"additionalProperties":false},"result":{"type":"object","required":["result_id","actor_thread_id","status","effective_dispatch_ids","output_digest","timestamp"],"properties":{"result_id":{"type":"string","minLength":1},"actor_thread_id":{"type":"string","minLength":1},"status":{"const":"completed"},"effective_dispatch_ids":{"type":"array","minItems":1,"items":{"type":"string","minLength":1}},"output_digest":{"type":"string","pattern":"^sha256:[0-9a-f]{64}$"},"timestamp":{"type":"string","format":"date-time"}},"additionalProperties":false}},"additionalProperties":false}
